{
  "$schema": "https://json-schema.org/draft/2020-12/schema",
  "title": "fiml FeatureExtractorSpec 2.0",
  "type": "object",
  "additionalProperties": false,
  "required": ["version", "capacity", "length", "required_events", "features"],
  "properties": {
    "version": { "const": "2.0" },
    "capacity": { "type": "integer", "minimum": 0 },
    "length": { "type": "integer", "minimum": 0 },
    "required_events": {
      "type": "array",
      "uniqueItems": true,
      "items": { "$ref": "#/$defs/requiredEvent" }
    },
    "checksum": { "type": "string" },
    "features": { "type": "array", "items": { "$ref": "#/$defs/group" } },
    "order_books": { "type": "array", "items": { "$ref": "#/$defs/orderBookConfig" } }
  },
  "$defs": {
    "requiredEvent": {
      "type": "object", "additionalProperties": false,
      "required": ["symbol", "event"],
      "properties": {
        "symbol": { "type": "string", "minLength": 1 },
        "event": { "enum": ["price", "volume", "trade", "order_book_delta", "order_book_snapshot", "time"] }
      },
      "allOf": [{
        "if": { "properties": { "event": { "const": "time" } } },
        "then": { "properties": { "symbol": { "const": "__global__" } } },
        "else": { "properties": { "symbol": { "not": { "const": "__global__" } } } }
      }]
    },
    "orderBookConfig": {
      "type": "object", "additionalProperties": false,
      "required": ["symbol", "update_policy", "buffer_size"],
      "properties": {
        "symbol": { "type": "string", "minLength": 1, "not": { "const": "__global__" } },
        "update_policy": { "enum": ["monotonic", "contiguous"] },
        "buffer_size": { "type": "integer", "minimum": 0 },
        "dense": { "$ref": "#/$defs/denseBookConfig" }
      }
    },
    "denseBookConfig": {
      "type": "object", "additionalProperties": false,
      "required": ["tick_size", "min_price", "max_price"],
      "properties": {
        "tick_size": { "type": "string", "pattern": "^\\+?(?=.*[1-9])(?:[0-9]+(?:\\.[0-9]*)?|\\.[0-9]+)$" },
        "min_price": { "type": "string", "pattern": "^\\+?(?:[0-9]+(?:\\.[0-9]*)?|\\.[0-9]+)$" },
        "max_price": { "type": "string", "pattern": "^\\+?(?:[0-9]+(?:\\.[0-9]*)?|\\.[0-9]+)$" }
      }
    },
    "group": {
      "type": "object", "additionalProperties": false,
      "required": ["symbol", "indicators"],
      "properties": {
        "symbol": { "type": "string", "minLength": 1 },
        "indicators": { "type": "array", "minItems": 1, "items": { "$ref": "#/$defs/indicator" } }
      },
      "allOf": [{
        "if": { "properties": { "symbol": { "const": "__global__" } } },
        "then": { "properties": { "indicators": { "items": { "properties": { "kind": { "enum": ["context", "day_of_week", "time_since_first_event_of_day"] } } } } } },
        "else": { "properties": { "indicators": { "items": { "properties": { "kind": { "not": { "enum": ["day_of_week", "time_since_first_event_of_day"] } } } } } } }
      }]
    },
    "indicator": {
      "type": "object", "additionalProperties": false,
      "required": ["kind", "source"],
      "properties": {
        "kind": { "enum": ["context", "field", "cvd", "simple_return", "log_return", "volatility", "sma_timed", "obv_timed", "volatility_timed", "vpt", "trade_count_timed", "trade_volume_timed", "vwap_timed", "day_of_week", "time_since_first_event_of_day", "order_book_bid_added_volume", "order_book_bid_removed_volume", "order_book_ask_added_volume", "order_book_ask_removed_volume", "order_book_mid_price", "order_book_spread", "order_book_spread_bps", "order_book_weighted_mid_price", "order_book_microprice", "order_book_imbalance", "order_book_best_bid_price", "order_book_best_bid_size", "order_book_best_ask_price", "order_book_best_ask_size", "order_book_level_size", "order_book_nth_price", "order_book_nth_size", "order_book_depth_until_price", "order_book_depth_until_size_price_from", "order_book_depth_until_size_price_to", "order_book_depth_until_size_total_size", "order_book_volume_between_prices"] },
        "source": { "$ref": "#/$defs/source" },
        "warmup_policy": { "enum": ["first_value", "full_window"] },
        "options": { "$ref": "#/$defs/options" },
        "outputs": { "type": "array", "minItems": 1, "items": { "$ref": "#/$defs/output" } }
      },
      "allOf": [
        {
          "if": { "properties": { "kind": { "const": "context" } } },
          "then": {
            "required": ["options"],
            "properties": {
              "source": { "const": { "type": "context" } },
              "warmup_policy": false,
              "options": {
                "type": "object", "additionalProperties": false,
                "required": ["name"],
                "properties": { "name": { "type": "string", "minLength": 1 } }
              },
              "outputs": { "maxItems": 1, "items": { "not": { "required": ["window"] } } }
            }
          },
          "else": { "properties": { "options": { "properties": { "name": false } } } }
        },
        {
          "if": { "properties": { "kind": { "pattern": "^order_book_" } } },
          "then": {
            "properties": {
              "source": { "const": { "type": "order_book" } },
              "warmup_policy": false,
              "outputs": { "maxItems": 16, "items": { "allOf": [{ "not": { "required": ["window"] } }, { "not": { "required": ["lag"] } }] } }
            },
            "allOf": [
              {
                "if": {"properties": {"kind": {"enum": ["order_book_level_size", "order_book_nth_price", "order_book_nth_size", "order_book_depth_until_price", "order_book_depth_until_size_price_from", "order_book_depth_until_size_price_to", "order_book_depth_until_size_total_size", "order_book_volume_between_prices"]}}},
                "then": {
                  "required": ["options"],
                  "oneOf": [
                    {"properties": {"kind": {"const": "order_book_level_size"}, "options": {"type": "object", "additionalProperties": false, "required": ["side", "price"], "properties": {"side": {"enum": ["bid", "ask"]}, "price": {"type": "string", "pattern": "^\\+?(?:[0-9]+(?:\\.[0-9]*)?|\\.[0-9]+)$"}}}}},
                    {"properties": {"kind": {"const": "order_book_nth_price"}, "options": {"type": "object", "additionalProperties": false, "required": ["side", "n_levels"], "properties": {"side": {"enum": ["bid", "ask"]}, "n_levels": {"type": "integer", "minimum": 1}}}}},
                    {"properties": {"kind": {"const": "order_book_nth_size"}, "options": {"type": "object", "additionalProperties": false, "required": ["side", "n_levels"], "properties": {"side": {"enum": ["bid", "ask"]}, "n_levels": {"type": "integer", "minimum": 1}}}}},
                    {"properties": {"kind": {"const": "order_book_depth_until_price"}, "options": {"type": "object", "additionalProperties": false, "required": ["side", "price"], "properties": {"side": {"enum": ["bid", "ask"]}, "price": {"type": "string", "pattern": "^\\+?(?:[0-9]+(?:\\.[0-9]*)?|\\.[0-9]+)$"}}}}},
                    {"properties": {"kind": {"const": "order_book_depth_until_size_price_from"}, "options": {"type": "object", "additionalProperties": false, "required": ["side", "size"], "properties": {"side": {"enum": ["bid", "ask"]}, "size": {"type": "string", "pattern": "^\\+?(?=.*[1-9])(?:[0-9]+(?:\\.[0-9]*)?|\\.[0-9]+)$"}}}}},
                    {"properties": {"kind": {"const": "order_book_depth_until_size_price_to"}, "options": {"type": "object", "additionalProperties": false, "required": ["side", "size"], "properties": {"side": {"enum": ["bid", "ask"]}, "size": {"type": "string", "pattern": "^\\+?(?=.*[1-9])(?:[0-9]+(?:\\.[0-9]*)?|\\.[0-9]+)$"}}}}},
                    {"properties": {"kind": {"const": "order_book_depth_until_size_total_size"}, "options": {"type": "object", "additionalProperties": false, "required": ["side", "size"], "properties": {"side": {"enum": ["bid", "ask"]}, "size": {"type": "string", "pattern": "^\\+?(?=.*[1-9])(?:[0-9]+(?:\\.[0-9]*)?|\\.[0-9]+)$"}}}}},
                    {"properties": {"kind": {"const": "order_book_volume_between_prices"}, "options": {"type": "object", "additionalProperties": false, "required": ["side", "from_price", "to_price"], "properties": {"side": {"enum": ["bid", "ask"]}, "from_price": {"type": "string", "pattern": "^\\+?(?:[0-9]+(?:\\.[0-9]*)?|\\.[0-9]+)$"}, "to_price": {"type": "string", "pattern": "^\\+?(?:[0-9]+(?:\\.[0-9]*)?|\\.[0-9]+)$"}}}}}
                  ]
                },
                "else": {"properties": {"options": {"maxProperties": 0}}}
              }
            ],
            "if": { "properties": { "kind": { "const": "order_book_imbalance" } } },
            "then": {
              "required": ["outputs"],
              "properties": { "outputs": { "items": { "required": ["n_levels"] } } }
            },
            "else": {
              "properties": { "outputs": { "maxItems": 1, "items": { "not": { "required": ["n_levels"] } } } }
            }
          },
          "else": {
            "properties": {
              "source": { "not": { "properties": { "type": { "const": "order_book" } } } },
              "options": { "properties": {"side": false, "price": false, "size": false, "from_price": false, "to_price": false, "n_levels": false} },
              "outputs": { "items": { "not": { "required": ["n_levels"] } } }
            }
          }
        },
        {
          "if": { "properties": { "kind": { "enum": ["simple_return", "log_return"] } } },
          "then": {
            "required": ["outputs"],
            "properties": {
              "warmup_policy": false,
              "options": { "maxProperties": 0 },
              "outputs": { "maxItems": 16, "items": { "required": ["lag"], "not": { "required": ["window"] } } }
            }
          },
          "else": { "properties": { "outputs": { "items": { "not": { "required": ["lag"] } } } } }
        },
        {
          "if": { "properties": { "kind": { "enum": ["cvd", "volatility"] } } },
          "then": {
            "required": ["warmup_policy", "outputs"],
            "properties": {
              "options": { "maxProperties": 0 },
              "outputs": {
                "maxItems": 16,
                "items": {
                  "required": ["window"],
                  "properties": { "window": { "type": "integer", "minimum": 1 } }
                }
              }
            }
          }
        },
        {
          "if": { "properties": { "kind": { "enum": ["sma_timed", "obv_timed", "volatility_timed", "trade_count_timed", "trade_volume_timed", "vwap_timed"] } } },
          "then": {
            "required": ["warmup_policy", "options", "outputs"],
            "properties": {
              "options": {
                "type": "object", "additionalProperties": false,
                "required": ["aggregation"],
                "properties": { "aggregation": { "$ref": "#/$defs/duration" } }
              },
              "outputs": {
                "maxItems": 16,
                "items": {
                  "required": ["window"],
                  "properties": { "window": { "$ref": "#/$defs/duration" } }
                }
              }
            }
          }
        },
        {
          "if": { "properties": { "kind": { "const": "trade_count_timed" } } },
          "then": { "properties": { "outputs": { "maxItems": 1 } } }
        },
        {
          "if": { "properties": { "kind": { "enum": ["field", "vpt", "day_of_week"] } } },
          "then": {
            "properties": {
              "warmup_policy": false,
              "options": { "maxProperties": 0 },
              "outputs": { "maxItems": 1, "items": { "not": { "required": ["window"] } } }
            }
          }
        },
        {
          "if": { "properties": { "kind": { "const": "time_since_first_event_of_day" } } },
          "then": {
            "required": ["options"],
            "properties": {
              "warmup_policy": false,
              "options": {
                "type": "object", "additionalProperties": false,
                "required": ["utc_offset"],
                "properties": { "utc_offset": { "type": "string", "pattern": "^[+-][0-9]{2}:[0-9]{2}$" } }
              },
              "outputs": { "maxItems": 1, "items": { "not": { "required": ["window"] } } }
            }
          }
        },
        {
          "if": { "properties": { "kind": { "enum": ["field", "simple_return", "log_return", "volatility", "sma_timed", "volatility_timed"] } } },
          "then": { "properties": { "source": { "properties": { "type": { "const": "field" } } } } }
        },
        {
          "if": { "properties": { "kind": { "enum": ["cvd", "obv_timed", "vpt", "trade_count_timed", "trade_volume_timed", "vwap_timed"] } } },
          "then": { "properties": { "source": { "const": { "type": "event", "event": "trade" } } } }
        },
        {
          "if": { "properties": { "kind": { "enum": ["day_of_week", "time_since_first_event_of_day"] } } },
          "then": { "properties": { "source": { "const": { "type": "any_event" } } } }
        }
      ]
    },
    "source": {
      "oneOf": [
        { "const": { "type": "context" } },
        {
          "type": "object", "additionalProperties": false,
          "required": ["type"],
          "properties": { "type": { "const": "order_book" } }
        },
        {
          "type": "object", "additionalProperties": false,
          "required": ["type", "event", "field"],
          "properties": {
            "type": { "const": "field" },
            "event": { "const": "price" },
            "field": { "const": "value" }
          }
        },
        {
          "type": "object", "additionalProperties": false,
          "required": ["type", "event", "field"],
          "properties": {
            "type": { "const": "field" },
            "event": { "const": "volume" },
            "field": { "const": "value" }
          }
        },
        {
          "type": "object", "additionalProperties": false,
          "required": ["type", "event", "field"],
          "properties": {
            "type": { "const": "field" },
            "event": { "const": "trade" },
            "field": { "const": "price" }
          }
        },
        {
          "type": "object", "additionalProperties": false,
          "required": ["type", "event", "field"],
          "properties": {
            "type": { "const": "field" },
            "event": { "const": "trade" },
            "field": { "const": "volume" }
          }
        },
        {
          "type": "object", "additionalProperties": false,
          "required": ["type", "event"],
          "properties": {
            "type": { "const": "event" },
            "event": { "enum": ["price", "volume", "trade", "order_book_delta", "order_book_snapshot", "time"] }
          }
        },
        {
          "type": "object", "additionalProperties": false,
          "required": ["type"],
          "properties": { "type": { "const": "any_event" } }
        }
      ]
    },
    "options": {
      "type": "object", "additionalProperties": false,
      "properties": {
        "name": { "type": "string", "minLength": 1 },
        "side": {"enum": ["bid", "ask"]},
        "price": {"type": "string"},
        "size": {"type": "string"},
        "from_price": {"type": "string"},
        "to_price": {"type": "string"},
        "n_levels": {"type": "integer", "minimum": 1},

        "aggregation": { "$ref": "#/$defs/duration" },
        "utc_offset": { "type": "string", "pattern": "^[+-][0-9]{2}:[0-9]{2}$" }
      }
    },
    "output": {
      "type": "object", "additionalProperties": false,
      "properties": {
        "n_levels": { "type": "integer", "minimum": 1 },
        "lag": { "type": "integer", "minimum": 1 },
        "window": { "oneOf": [{ "type": "integer", "minimum": 1 }, { "$ref": "#/$defs/duration" }] },
        "id": { "type": "string", "not": { "pattern": "^__reserved_" } }
      }
    },
    "duration": { "type": "string", "pattern": "^[1-9][0-9]*(ms|s|m|h)$" }
  }
}
