{
  "version": "2.0",
  "capacity": 5,
  "length": 5,
  "required_events": [
    {
      "symbol": "__global__",
      "event": "time"
    },
    {
      "symbol": "btcusdt",
      "event": "trade"
    },
    {
      "symbol": "ethusdt",
      "event": "trade"
    }
  ],
  "features": [
    {
      "symbol": "__global__",
      "indicators": [
        {
          "kind": "day_of_week",
          "source": {
            "type": "any_event"
          }
        }
      ]
    },
    {
      "symbol": "btcusdt",
      "indicators": [
        {
          "kind": "field",
          "source": {
            "type": "field",
            "event": "trade",
            "field": "price"
          }
        },
        {
          "kind": "trade_count_timed",
          "source": {
            "type": "event",
            "event": "trade"
          },
          "warmup_policy": "full_window",
          "options": {
            "aggregation": "1ms"
          },
          "outputs": [
            {
              "window": "1m"
            }
          ]
        }
      ]
    },
    {
      "symbol": "ethusdt",
      "indicators": [
        {
          "kind": "field",
          "source": {
            "type": "field",
            "event": "trade",
            "field": "price"
          }
        },
        {
          "kind": "trade_count_timed",
          "source": {
            "type": "event",
            "event": "trade"
          },
          "warmup_policy": "full_window",
          "options": {
            "aggregation": "1ms"
          },
          "outputs": [
            {
              "window": "1m"
            }
          ]
        }
      ]
    }
  ]
}
